### ISSUE TITLE
DNS resolution of short names on Windows not working

### ISSUE THREAD

**Issue by Falco20019** [docker/for-win#4425]
- [x] I have tried with the latest version of my channel (Stable or Edge)
  - [x] I have uploaded Diagnostics
  - Diagnostics ID: 53C998BD-DB0C-42FF-A5CE-7F86575C5F45/20190805102338

When in Linux container mode, Docker is not able to resolve the server `srv1s00383` anymore. Using the FQDN `srv1s00383.business.company.com` still works. This worked before updating to Docker 2.1.0.0 and also still works on our machines that have not been updated.

It still works in 2.1.0.0 when in Windows container mode. So the problem seems to be related with the Moby VM not always using the DNS server of the host.

### Expected behavior
C:\Users\xxx>docker login srv1s00383:443
Authenticating with existing credentials...
Login Succeeded

C:\Users\xxx>docker login srv1s00383.business.company.com:443
Authenticating with existing credentials...
Login Succeeded

### Actual behavior
C:\Users\xxx>docker login srv1s00383:443
Authenticating with existing credentials...
Login did not succeed, error: Error response from daemon: Get https://srv1s00383:443/v2/: dial tcp: lookup srv1s00383 on 192.168.65.1:53: no such host

C:\Users\xxx>docker login srv1s00383.business.company.com:443
Authenticating with existing credentials...
Login Succeeded

### Information
  - Windows Version: Windows 10 Version 1803 Build 17134.885
  - Docker Desktop Version: 2.1.0.0 (36874)

`docker version`
```
Client: Docker Engine - Community
 Version:           19.03.1
 API version:       1.40
 Go version:        go1.12.5
 Git commit:        74b1e89
 Built:             Thu Jul 25 21:17:08 2019
 OS/Arch:           windows/amd64
 Experimental:      false

Server: Docker Engine - Community
 Engine:
  Version:          19.03.1
  API version:      1.40 (minimum version 1.12)
  Go version:       go1.12.5
  Git commit:       74b1e89
  Built:            Thu Jul 25 21:17:52 2019
  OS/Arch:          linux/amd64
  Experimental:     false
 containerd:
  Version:          v1.2.6
  GitCommit:        894b81a4b802e4eb2a91d1ce216b8817763c29fb
 runc:
  Version:          1.0.0-rc8
  GitCommit:        425e105d5a03fabd737a126ad93d62a9eeede87f
 docker-init:
  Version:          0.18.0
  GitCommit:        fec3683
```

### Steps to reproduce the behavior

  1. docker login <shortname>:443

**Comment by apm963** [comment]
This issue is also affecting me on both stable and edge `19.03.1`. I have tried overriding DNS by setting a fixed DNS server in the network tab of setting and have also tried modifying the dockerd config json by adding `"dns": ["192.168.1.2"],` but neither attempt was successful.

```
docker pull my-intranet-registry:5000/my-image:latest
51c0fed8d2e38fba068d3e0f57a
Error response from daemon: Get https://my-intranet-registry:5000/v2/: dial tcp: lookup my-intranet-registry on 192.168.65.1:53: no such host
```

I have also tried the usual other Docker Desktop troubleshooting techniques (restart Docker, quit Docker, restart Windows, etc.) without success. This issue began happening after updating to Docker 2.1.0.0.

Diagnostics ID: `4E818E43-38AC-4E5E-AEAC-4C617B571847/20190805134240`

Log file excerpt after running `docker pull gitlogo:5000/swarm-dev-wrapper`:

```
[09:45:20.935][ApiProxy          ][Info   ] time="2019-08-05T09:45:20-04:00" msg="proxy >> HEAD /_ping\n"
[09:45:20.947][ApiProxy          ][Info   ] time="2019-08-05T09:45:20-04:00" msg="proxy << HEAD /_ping (12.091ms)\n"
[09:45:20.948][GoBackendProcess  ][Info   ] error CloseWrite to: The pipe is being closed.
[09:45:21.135][ApiProxy          ][Info   ] time="2019-08-05T09:45:21-04:00" msg="proxy >> POST /v1.40/images/create?fromImage=my-intranet-registry%3A5000%2Fmy-image&tag=latest\n"
[09:45:21.143][APIRequestLogger  ][Info   ] [e6b4cfdd-181d-4d72-a11c-cca5f2641f30] POST http://unix/usage
[09:45:21.144][APIRequestLogger  ][Info   ] [e6b4cfdd-181d-4d72-a11c-cca5f2641f30] POST http://unix/usage -> 200 OK took 0ms
[09:45:21.965][ApiProxy          ][Info   ] time="2019-08-05T09:45:21-04:00" msg="DNS failure: my-intranet-registry.\tIN\t A: errno 9002: DnsQuery: DNS server failure."
[09:45:21.966][ApiProxy          ][Info   ] time="2019-08-05T09:45:21-04:00" msg="DNS failure: my-intranet-registry.\tIN\t AAAA: errno 9002: DnsQuery: DNS server failure."
[09:45:22.793][ApiProxy          ][Info   ] time="2019-08-05T09:45:22-04:00" msg="DNS failure: my-intranet-registry.\tIN\t AAAA: errno 9002: DnsQuery: DNS server failure."
[09:45:22.794][ApiProxy          ][Info   ] time="2019-08-05T09:45:22-04:00" msg="DNS failure: my-intranet-registry.\tIN\t A: errno 9002: DnsQuery: DNS server failure."
[09:45:23.621][ApiProxy          ][Info   ] time="2019-08-05T09:45:23-04:00" msg="DNS failure: my-intranet-registry.\tIN\t AAAA: errno 9002: DnsQuery: DNS server failure."
[09:45:23.621][ApiProxy          ][Info   ] time="2019-08-05T09:45:23-04:00" msg="DNS failure: my-intranet-registry.\tIN\t A: errno 9002: DnsQuery: DNS server failure."
[09:45:24.450][ApiProxy          ][Info   ] time="2019-08-05T09:45:24-04:00" msg="DNS failure: my-intranet-registry.\tIN\t A: errno 9002: DnsQuery: DNS server failure."
[09:45:24.452][ApiProxy          ][Info   ] time="2019-08-05T09:45:24-04:00" msg="DNS failure: my-intranet-registry.\tIN\t AAAA: errno 9002: DnsQuery: DNS server failure."
[09:45:24.455][ApiProxy          ][Info   ] time="2019-08-05T09:45:24-04:00" msg="proxy << POST /v1.40/images/create?fromImage=my-intranet-registry%3A5000%2Fmy-image&tag=latest (3.3202423s)\n"
[09:45:24.456][GoBackendProcess  ][Info   ] error CloseWrite to: The pipe is being closed.
```

> Note that `my-intranet-registry` and `my-image` are stand-ins for the purpose of this issue.

The only known resolution is downgrading to the previous Docker Desktop stable build.

**Comment by apm963** [comment]
I was able to work around this issue by manually modifying the Moby VMs `resolv.conf`:

```
PS C:\Users\amazzarella> docker run --rm -it -v /etc/resolv.conf:/mnt/resolv.conf ubuntu:latest /bin/bash
```

Within the container:

```sh
cd /mnt
cat resolv.conf # "nameserver 192.168.65.1"
echo 'search MYDOMAIN' >> resolv.conf
echo 'nameserver 192.168.1.2' >> resolv.conf
exit
```

Back on host (no VM restart required):

```
PS C:\Users\amazzarella> docker pull my-intranet-registry:5000/my-image
Using default tag: latest
latest: Pulling from my-image
8e3ba11ec2a2: Already exists
10ba875c1cb7: Pull complete
9177e336ded0: Pull complete
cb838ec13f3f: Pull complete
ecf56c54443e: Pull complete
0f4a9fd1c8e2: Pull complete
893d78c10ae7: Pull complete
457ad0174684: Pull complete
fca28946f242: Pull complete
Digest: sha256:93dfb1635839d441a8228384eba2ef30fdce851c0fed8d2e38fba068d3e0f57a
Status: Downloaded newer image for my-intranet-registry:5000/my-image:latest
my-intranet-registry:5000/my-image:latest
```

**Comment by sdcooper** [comment]
Can confirm. Using an older docker version, my dns-search entry from the host resolv.conf is copied to the container's resolv.conf. Using 2.1.0.0 (36874), it is not.

**Comment by djs55** [comment]
@Falco20019 (and others) could you check to see if you have "Manual DNS Configuration" enabled in your Docker Desktop settings? I suspect there is a problem when in manual mode, but it should work in automatic mode.

Failing that, could you record some packet traces inside the VM? Use a command like
```
docker run -it -v c:\Users\djs\bugs:/tmp/bugs --net=host --privileged djs55/tcpdump -n -i eth0 -s 0 -w /tmp/bugs/dns.pcap port 53
```
Customise the path `c:\Users\djs\bugs` and then send me the resulting `dns.pcap` file which should have the captured DNS traffic in it.

**Comment by apm963** [comment]
Hi @djs55, I have tried both manual ("fixed") and automatic DNS server options and both manifest this issue. I ran the provided container in automatic DNS mode (with my previous `resolv.conf` override undone) and issued a `docker pull` on an intranet registry. Result below:

[dns.pcap.gz](https://github.com/docker/for-win/files/3473764/dns.pcap.gz)

**Comment by nathan-c** [comment]
I had same issue. Downgrading from 2.1.0.0 to 2.0.0.3 fixed this for me. As mentioned above it seems that the dns-search option will allow running containers to resolve local names but wont help when trying to push to (or a guess pull from) a private registry.

**Comment by mgroenhoff** [comment]
I'm having the exact same issue. It seems Docker is generating a `config.iso` with an invalid `resolv.conf` containing the entry `nameserver 192.168.65.1` which is not the DNS server used on the host (which is set by the domain controller). I have tried setting the dns server in the daemon.json config file but this option seems to be ignored.

**Comment by sdcooper** [comment]
This is physically preventing us from updating Docker on our desktops - this seems like a fairly fundamental problem, is there a reason it's not getting any attention?

**Comment by prasad-1210** [comment]
I'm facing exactly same issue on 2.11.0.5 (40693). Any workaround's to fix this issue?

**Comment by engek1** [comment]
We fixed it with advanced deamon configuration (settings>daemon>advanced). Add your company dns-server and the search scope to the json:
"dns": [
    "ip-of-company-dns-server"
  ],
  "dns-search": [
    "company.com"
  ]

**Comment by prasad-1210** [comment]
@engek1 Thanks for response. This works for communication from inside containers. But my Docker login, Docker Pull commands doesn't work without FQDN. 

Apparently this is due to moby image doesn't respect dns settings (Thanks to @apm963) and all commands to docker engine fails in my case.


This issue really sounds like a no brainer and still not fixed since long time now. Appreciate if this is fixed or provided with more elegant solution to fix it rather than modifying resolv.conf (which is BTW, a brilliant hack) 

Thanks,
Prasad.CH

> I was able to work around this issue by manually modifying the Moby VMs `resolv.conf`:
> 
> ```
> PS C:\Users\amazzarella> docker run --rm -it -v /etc/resolv.conf:/mnt/resolv.conf ubuntu:latest /bin/bash
> ```
> 
> Within the container:
> 
> ```shell
> cd /mnt
> cat resolv.conf # "nameserver 192.168.65.1"
> echo 'search MYDOMAIN' >> resolv.conf
> echo 'nameserver 192.168.1.2' >> resolv.conf
> exit
> ```
> 
> Back on host (no VM restart required):
> 
> ```
> PS C:\Users\amazzarella> docker pull my-intranet-registry:5000/my-image
> Using default tag: latest
> latest: Pulling from my-image
> 8e3ba11ec2a2: Already exists
> 10ba875c1cb7: Pull complete
> 9177e336ded0: Pull complete
> cb838ec13f3f: Pull complete
> ecf56c54443e: Pull complete
> 0f4a9fd1c8e2: Pull complete
> 893d78c10ae7: Pull complete
> 457ad0174684: Pull complete
> fca28946f242: Pull complete
> Digest: sha256:93dfb1635839d441a8228384eba2ef30fdce851c0fed8d2e38fba068d3e0f57a
> Status: Downloaded newer image for my-intranet-registry:5000/my-image:latest
> my-intranet-registry:5000/my-image:latest
> ```

**Comment by KylePreuss** [comment]
Fixed DNS Server setting is still not observed in v2.1.0.5.  Cannot push/pull from local registries using host name.

**Comment by apm963** [comment]
I can confirm this is still occurring on edge 2.1.7.0 (41536).

**Comment by mgroenhoff** [comment]
I would like to know if this is getting any attention. We are stuck on 2.0.0.3 (31259) for a while now and we still can't upgrade because of this.

**Comment by sathish2014** [comment]
Strangely, on my laptop I have 2.1.0.5 and it works fine. On my desktop system, I have 2.2.0.5 and it doesn't work. I tried every possible option that I could get from googling on this issue.

**Comment by originalnoe-nazvanie** [comment]
Sometimes it depends on your network adapter settings, it s a common problem in virtualized envs, try to disable both TCP and UDP offload on all network adapters, there is some magic with MTU packet size. It somehow depends on Segmentation and Checksum Offloading on UDP packets (DNS packets). It will not affect performance at all.

**Comment by TunerBuilder** [comment]
Any updates on this?
It really affects my workflow with docker compose.

**Comment by djs55** [comment]
Sorry for the delay in replying -- unfortunately we don't have an internal repro of this DNS problem so it's hard to work on.

Docker Desktop has a built-in DNS server which uses the host APIs to resolve names. If the DNS name resolves on the host, it ought to resolve in the VM also. The DNS server on the host is supposed to handle the search domains, rather than the resolver in the VM. I think to understand what is happening we need to see the DNS traffic on the VM, and the DNS traffic on the host.

The DNS traffic in the VM can be displayed with
```
% docker run --privileged --net=host djs55/tcpdump -n -i eth0 port 53 
tcpdump: verbose output suppressed, use -v or -vv for full protocol decode
listening on eth0, link-type EN10MB (Ethernet), capture size 262144 bytes
19:46:43.942431 IP 192.168.65.3.34256 > 192.168.65.1.53: 52146+ A? www.google.com. (32)
19:46:43.942474 IP 192.168.65.3.34256 > 192.168.65.1.53: 52425+ AAAA? www.google.com. (32)
19:46:43.944601 IP 192.168.65.1.53 > 192.168.65.3.34256: 52146 1/0/0 A 216.58.204.36 (48)
```
(to capture to a file you can use `docker run --privileged --net=host -v C:\Users\someone:/out djs55/tcpdump -n -s 0 -w /out/dns.pcap -i eth0 port 53`)

A tool like [wireshark](https://www.wireshark.org) can be used to view the DNS traffic on the host.

If someone with a repro could create some packet traces I'd be grateful.

**Comment by neiltwist** [comment]
> Sorry for the delay in replying -- unfortunately we don't have an internal repro of this DNS problem so it's hard to work on.
> 
> Docker Desktop has a built-in DNS server which uses the host APIs to resolve names. If the DNS name resolves on the host, it ought to resolve in the VM also. The DNS server on the host is supposed to handle the search domains, rather than the resolver in the VM. I think to understand what is happening we need to see the DNS traffic on the VM, and the DNS traffic on the host.
> ...
> If someone with a repro could create some packet traces I'd be grateful.

Is this issue only for the MobyVM or also for the WSL2 backend?

I have this problem at work in both Moby and WSL2, but I could fix it in Moby by using the following script:

```
docker run \
    --net=host \
    --ipc=host \
    --uts=host \
    --pid=host \
    --security-opt=seccomp=unconfined \
    --privileged \
    --rm \
    -it \
    -v /:/host \
    alpine \
        /bin/sh -c \
            "echo search DOMAIN.com SUB.DOMAIN.com >> /host/etc/resolv.conf"
```
I cannot do similar in  WSL2, which is a breaking change for me.

The problem for me, stems from the Primary DNS Suffix being `SUB.DOMAIN.com` and the DNS suffix search list being `DOMAIN.com SUB.DOMAIN.com`, which works for the Windows based hosts, but I need to contact the internal Nexus server, which is `nexus.DOMAIN.com`.

Docker itself doesn't seem to pick up the DNS suffix list, which (in resolv.conf, both in Moby and WSL2) has no search line. I can get the containers to see the correct settings by setting the dns-search value in the json daemon config, but this isn't respected by `docker login`, `docker pull` etc.

The error I get is `Login did not succeed, error: Error response from daemon: Get https://hpc-p-cfd-nx3:18444/v2/: dial tcp: lookup nexus on 192.168.65.1:53: no such host`, and when I refer to the FQDN I get `Error response from daemon: Get https://nexus.DOMAIN.com:18444/v2/: x509: certificate is valid for nexus,..., not nexus.DOMAIN.com`.

So, my guess would be that Docker-for-win is reading the Primary Suffix, but not the list. I have no way of testing the Primary Suffix as I don't have a host setup with something Docker can interact with.

DNS traffic in WSL2 when using only the short name is as follows:
```
12 packets captured
12 packets received by filter
0 packets dropped by kernel
16:44:21.567061 IP 192.168.65.3.52664 > 192.168.65.1.53: 30737+ A? nexus. (31)
16:44:22.410379 IP 192.168.65.1.53 > 192.168.65.3.58161: 38614 0/0/0 (31)
16:44:22.410410 IP 192.168.65.1.53 > 192.168.65.3.52664: 30737 0/0/0 (31)
16:44:22.410685 IP 192.168.65.3.44504 > 192.168.65.1.53: 29292+ A? nexus. (31)
16:44:22.410719 IP 192.168.65.3.43192 > 192.168.65.1.53: 6311+ AAAA? nexus. (31)
16:44:23.247123 IP 192.168.65.1.53 > 192.168.65.3.44504: 29292 0/0/0 (31)
16:44:23.247153 IP 192.168.65.1.53 > 192.168.65.3.43192: 6311 0/0/0 (31)
16:44:23.247588 IP 192.168.65.3.39786 > 192.168.65.1.53: 24289+ AAAA? nexus. (31)
16:44:23.247645 IP 192.168.65.3.45154 > 192.168.65.1.53: 54657+ A? nexus. (31)
16:44:24.087036 IP 192.168.65.1.53 > 192.168.65.3.39786: 24289 0/0/0 (31)
16:44:24.087065 IP 192.168.65.1.53 > 192.168.65.3.45154: 54657 0/0/0 (31)
```

**Comment by simonferquel** [comment]
We think we have a fix for this one. Can you try this private build: https://desktop-stage.docker.com/win/edge/47356/Docker%20Desktop%20Installer.exe

**Comment by b1ackf0ld** [comment]
> We think we have a fix for this one. Can you try this private build: https://desktop-stage.docker.com/win/edge/47356/Docker%20Desktop%20Installer.exe

This fixed my problem that I’ve been frustrated for months (finally).
Note: there’s an updated version on Edge channel which is broken again. This is so far the only version that works.

**Comment by mat007** [comment]
> there’s an updated version on Edge channel which is broken again. This is so far the only version that works.

We haven’t released this fix yet, it will be included in the next Edge (2.3.6.0) which we will be released tomorrow.
Thanks for testing the fix!

**Comment by mat007** [comment]
This issue has been fixed in Edge 2.3.6.0, I’ll go ahead and close this ticket.
Thanks!

**Comment by djs55** [comment]
The fix has now also been released on [stable 2.4.0.0](https://desktop.docker.com/win/stable/48506/Docker%20Desktop%20Installer.exe).
