### ISSUE TITLE
tftpd server - host is unreachable during the response UDP message

### ISSUE THREAD

**Issue by jacobblock** [docker/for-win#1791]
### Expected behavior
I am trying to run a tftpd server in a docker container and have it reachable from at least the host and eventually as a service. I expect a windows command `tftp 127.0.0.1 GET test` to return the test file on the server.

### Actual behavior
Running tcpdump I see the request coming into the container but the response UDP packet has an "unreachable" destination. The tftpd server works fine from inside the container.

> root@8bd28fee5c3a:/var/lib/tftpboot# tcpdump
tcpdump: verbose output suppressed, use -v or -vv for full protocol decode
listening on eth0, link-type EN10MB (Ethernet), capture size 262144 bytes
03:55:55.938048 IP 172.17.0.1.38470 > 8bd28fee5c3a.http: Flags [P.], seq 4131968876:4131969375, ack 3952672081, win 254, options [nop,nop,TS val 1554280 ecr 1551230], length 499: HTTP: GET / HTTP/1.1
03:55:55.938310 IP 8bd28fee5c3a.http > 172.17.0.1.38470: Flags [P.], seq 1:190, ack 499, win 260, options [nop,nop,TS val 1554280 ecr 1554280], length 189: HTTP: HTTP/1.1 304 Not Modified
03:55:55.938356 IP 172.17.0.1.38470 > 8bd28fee5c3a.http: Flags [.], ack 190, win 262, options [nop,nop,TS val 1554280 ecr 1554280], length 0
03:55:55.938734 IP 8bd28fee5c3a.34850 > 192.168.65.1.domain: 32824+ PTR? 1.0.17.172.in-addr.arpa. (41)
03:55:55.987568 IP 192.168.65.1.domain > 8bd28fee5c3a.34850: 32824 NXDomain 0/0/0 (41)
03:55:55.987965 IP 8bd28fee5c3a.35416 > 192.168.65.1.domain: 51439+ PTR? 1.65.168.192.in-addr.arpa. (43)
03:55:57.042091 IP 192.168.65.1.domain > 8bd28fee5c3a.35416: 51439 NXDomain 0/0/0 (43)
03:56:11.586523 IP 172.17.0.1.49092 > 8bd28fee5c3a.tftp:  16 RRQ "test" netascii
03:56:11.587683 IP 8bd28fee5c3a.55221 > 172.17.0.1.49092: UDP, length 25
03:56:11.587730 IP 172.17.0.1 > 8bd28fee5c3a: ICMP 172.17.0.1 udp port 49092 unreachable, length 61
03:56:12.587644 IP 172.17.0.1.49092 > 8bd28fee5c3a.tftp:  16 RRQ "test" netascii
03:56:12.591960 IP 8bd28fee5c3a.59416 > 172.17.0.1.49092: UDP, length 25
03:56:12.592064 IP 172.17.0.1 > 8bd28fee5c3a: ICMP 172.17.0.1 udp port 49092 unreachable, length 61
03:56:14.586992 IP 172.17.0.1.49092 > 8bd28fee5c3a.tftp:  16 RRQ "test" netascii
03:56:14.588192 IP 8bd28fee5c3a.40154 > 172.17.0.1.49092: UDP, length 25
03:56:14.588270 IP 172.17.0.1 > 8bd28fee5c3a: ICMP 172.17.0.1 udp port 49092 unreachable, length 61
03:56:18.588378 IP 172.17.0.1.49092 > 8bd28fee5c3a.tftp:  16 RRQ "test" netascii
03:56:18.591126 IP 8bd28fee5c3a.56675 > 172.17.0.1.49092: UDP, length 25
03:56:18.591228 IP 172.17.0.1 > 8bd28fee5c3a: ICMP 172.17.0.1 udp port 49092 unreachable, length 61

### Information

- Diagnostic ID: A789F16B-C3B2-4F69-811A-BD22D1E400BD/2018-03-05_21-50-51

- Dockerfile:

```
FROM ubuntu:16.04

RUN apt update && apt install -y \
  tftpd-hpa \
  tftp \
  tcpdump \
  nginx

# TFTP
WORKDIR /var/lib/tftpboot
RUN echo "Testing TFTP server" >> test

EXPOSE 69/UDP 80/TCP

WORKDIR /root

ENTRYPOINT service tftpd-hpa start && service nginx start && /bin/bash
```
  - Host is Windows 10, docker for windows package 17.12.0-ce-win47 (15139).
docker version:
> Client:
 Version:       17.12.0-ce
 API version:   1.35
 Go version:    go1.9.2
 Git commit:    c97c6d6
 Built: Wed Dec 27 20:05:22 2017
 OS/Arch:       windows/amd64
>
> Server:
 Engine:
  Version:      17.12.0-ce
  API version:  1.35 (minimum version 1.12)
  Go version:   go1.9.2
  Git commit:   c97c6d6
  Built:        Wed Dec 27 20:12:29 2017
  OS/Arch:      linux/amd64
  Experimental: true

docker info:
> Containers: 1
 Running: 1
 Paused: 0
 Stopped: 0
Images: 62
Server Version: 17.12.0-ce
Storage Driver: overlay2
 Backing Filesystem: extfs
 Supports d_type: true
 Native Overlay Diff: true
Logging Driver: json-file
Cgroup Driver: cgroupfs
Plugins:
 Volume: local
 Network: bridge host ipvlan macvlan null overlay
 Log: awslogs fluentd gcplogs gelf journald json-file logentries splunk syslog
Swarm: inactive
Runtimes: runc
Default Runtime: runc
Init Binary: docker-init
containerd version: 89623f28b87a6004d4b785663257362d1658a729
runc version: b2567b37d7b75eb4cf325b77297b140ea686ce8f
init version: 949e6fa
Security Options:
 seccomp
  Profile: default
Kernel Version: 4.9.60-linuxkit-aufs
Operating System: Docker for Windows
OSType: linux
Architecture: x86_64
CPUs: 2
Total Memory: 1.934GiB
Name: linuxkit-00155d00ef0e
ID: T2LH:HX27:ONV5:VKHT:F6DU:QJF6:QTNX:5GSM:GASO:KL56:GHZP:J6HU
Docker Root Dir: /var/lib/docker
Debug Mode (client): false
Debug Mode (server): true
 File Descriptors: 26
 Goroutines: 53
 System Time: 2018-03-06T04:36:38.9143514Z
 EventsListeners: 1
Registry: https://index.docker.io/v1/
Labels:
Experimental: true
Insecure Registries:
 127.0.0.0/8
Live Restore Enabled: false

### Steps to reproduce the behavior

  1. docker build -t tftpd .
  2. docker run --rm -p 69:69/udp -p 80:80/tcp --name tftpd -it tftpd bash
  3. May want to run tcpdump in the container.
  4. Open up local browser, nginx loads fine. TCP packets are fine.
  5. From powershell (you need tftp client windows feature installed), run "tftp 127.0.0.1 GET test". Request is fine, response is failed. Powershell hangs and repeats the command until aborting.

Thanks for the help!

**Comment by jacobblock** [comment]
Anyone able to confirm the issue is repeatable? Thanks,

**Comment by jacobblock** [comment]
Looks like I'm not able to add any additional labels myself. Probably area/network and kind/bug? Thanks.

**Comment by garywill** [comment]
I have the same problem.
```
408	2017.994698590	172.17.0.1	38756	172.17.0.2	69	TFTP	66	Read Request, File: mod, Transfer type: octet
409	2017.995182582	172.17.0.2	57398	172.17.0.1	38756	TFTP	558	Data Packet, Block: 1
410	2017.995219934	172.17.0.1	57398	172.17.0.2	38756	ICMP	586	Destination unreachable (Port unreachable)
```
I am using docker 17.09 on Linux x64

**Comment by roozbehid** [comment]
I think udp in dockers in windows are badly broken. I am also having so many problem with them like https://github.com/moby/moby/issues/37709

**Comment by beenishkh** [comment]
I am seeing this exact same issue for ubuntu
