### ISSUE TITLE
tftp server unable to send UDP messages in response to tftp request

### ISSUE THREAD

**Issue by KevinNapper** [docker/for-win#9315]
- [x] I have tried with the latest version of my channel (Stable or Edge)
  - [ ] I have uploaded Diagnostics
  - Diagnostics ID:

This appears to be the same problem as https://github.com/docker/for-win/issues/1791 but that has been closed and indicates that new issues should be raised for similar problems.

### Expected behavior
tftp "get" request from Windows host to a tftp server running inside Docker running on same host should result in the requested file being transferred.

### Actual behavior
Transfer fails and running tcpdump inside container reveals failure of UDP messages being sent by tftp server e.g.:

11:53:06.732903 IP 172.17.0.1 > cfefecaa22e1: ICMP 172.17.0.1 udp port 49190 unreachable, length 61
11:53:07.749114 IP 172.17.0.1.49190 > cfefecaa22e1.69:  21 RRQ "test_file" netascii
11:53:07.751808 IP cfefecaa22e1.42504 > 172.17.0.1.49190: UDP, length 25
11:53:07.752115 IP 172.17.0.1 > cfefecaa22e1: ICMP 172.17.0.1 udp port 49190 unreachable, length 61
11:53:09.749742 IP 172.17.0.1.49190 > cfefecaa22e1.69:  21 RRQ "test_file" netascii
11:53:09.752743 IP cfefecaa22e1.46973 > 172.17.0.1.49190: UDP, length 25
11:53:09.752904 IP 172.17.0.1 > cfefecaa22e1: ICMP 172.17.0.1 udp port 49190 unreachable, length 61
11:53:13.768647 IP 172.17.0.1.49190 > cfefecaa22e1.69:  21 RRQ "test_file" netascii
11:53:13.770991 IP cfefecaa22e1.42827 > 172.17.0.1.49190: UDP, length 25

### Information

  - Windows Version: Windows 10 Pro 20H2, OS build 19042.572, Windows Feature Experience Pack 120.2212.31.0
  - Docker Desktop Version: 2.4.0.0 (48506)
  - Are you running inside a virtualized Windows e.g. on a cloud server or on a mac VM: No, running direct on Windows laptop.

### Steps to reproduce the behavior

  1. Create Dockerfile containing:

FROM alpine

RUN apk add --no-cache tftp-hpa tcpdump

EXPOSE 69/udp

ENTRYPOINT ["in.tftpd"]

CMD ["-L", "--secure", "/var/tftpboot"]

  2. Build Dockerfile: docker build -t docker-tftp . 
  3. Run Docker image: e.g. docker run -p 0.0.0.0:69:69/udp --mount type=bind,src=/c/users/kev/docker/tftp,dst=/var/tftpboot -i -t docker-tftp
  4. Open CLI on container and run tcpdump
  5. Make a tftp request from the host machine e.g. tftp localhost get test_file

**Comment by KevinNapper** [comment]
There is a tickbox at the top of this issue labelled "I have uploaded Diagnostics". I have not ticked it because I am not sure what information you require. Please let me know if more information is required to help with this issue and I shall do my best to supply it.
