### ISSUE TITLE
Docker network connection time outs to host over time

### ISSUE THREAD

**Issue by rg9400** [docker/for-win#8861]
- [ ] I have tried with the latest version of my channel (Stable or Edge)
  - [ ] I have uploaded Diagnostics
  - Diagnostics ID: 7E746511-651C-4A74-8C84-91189E8962C1/20201006161122

### Expected behavior
I would expect services running inside Docker containers in a WSL backend to be able to reliably communicate with applications running on the host, even with frequent polling
### Actual behavior
Due to https://github.com/docker/for-win/issues/8590, I have to run some applications that require high download speeds on the host. I have multiple applications inside Docker containers running inside a Docker bridge network that poll this application every few seconds. When launching WSL, the applications are able to communicate reliably, but this connection deteriorates over time, and after 1-2 days, I notice frequent `connection timed out` responses from the application running on the host. Running `wsl --shutdown` and restarting the Docker daemon fixes the issue temporarily. Shifting applications out of Docker and onto the host fixes their communication issues as well. It may be related to the overall network issues linked above.

To be clear, it can still connect. It just starts timing out more and more often the longer the network/containers have been up. 

### Information

  - Windows Version: 2004 (OS Build 19041.508)
  - Docker Desktop Version: 2.4.1.0 (48583)
  - Are you running inside a virtualized Windows e.g. on a cloud server or on a mac VM: No

I have had this problem ever since starting to use Docker for Windows with the WSL2 backend. 

### Steps to reproduce the behavior

1. Run an application on the Windows host. I tried with NZBGet (host ip: 192.168.1.2)
2. Poll this application from within a Docker container inside a Docker bridge network living within WSL2. I polled 192.168.1.2:6789 every few seconds
3. Check back in a day to see if the connection is timing out more frequently.
4. Restart WSL/Docker daemon, notice that the connection is suddenly more reliable  though it will begin to deteriorate over time again

**Comment by rg9400** [comment]
This seems to improve if you use the recommended `host.docker.internal` option instead of using the IP of the host machine directly

**Comment by rg9400** [comment]
Further update on this. While the above does prolong the deterioration, it still eventually happens. After 4-5 days, timeouts start occurring at increasing frequency, with it eventually reaching a point where timeouts are happening on almost every few calls, requiring a full restart of WSL and Docker to function.

**Comment by markoueis** [comment]
We have the same issue
1. Using 2.4.0.0
2. We use host.docker.internal

We have a service running on the host.

If i try to hit host.docker.internal from within a linux container i can always get it to trip up eventually after say 5000 curl requests to http:\\host.docker.internal\service (it timesout for one request)

If i try http:\\host.docker.internal\service from the host, it works flawlessly even after 10000 curl requests

Sometimes, intermittently, and we can't find out why, it starts to fail much more frequently (like maybe every 100 curl requests)

Something is up with the networking...

**Comment by markoueis** [comment]
In my limited testing, i created a loopback adapter and used it instead. I created an ip 10.0.75.2 and used it instead. It's much more reliable. It's an ugly work around but it might work at least to help show where the issue might be.

**Comment by markoueis** [comment]
Hey guys, this is still happening pretty consistently. Is anyone looking at the reliability/performance of these things? Is this the wrong place to post this?

**Comment by rg9400** [comment]
I was able to send this via their support and have them reproduce the issue. They diagnosed the cause, but said it would involve some major refactoring, so they didn't have a target fix date. Below is the issue as mentioned by them


>  I can reproduce the bug now. If I query the vpnkit diagnostics with this program https://github.com/djs55/bug-repros/tree/main/tools/vpnkit-diagnostics while the connection is stuck then I observe: (for my particular repro the port number was 51580. I discovered this using wireshark to explore the trace)
> ```
> $ tcpdump -r capture\\all.pcap port 51580
> 15:57:03.021934 IP 192.168.65.3.51580 > 192.168.65.2.6789: Flags [S], seq 609899732, win 64240, options [mss 1460,sackOK,TS val 2195077730 ecr 0,nop,wscale 7], length 0
> 15:57:04.064094 IP 192.168.65.3.51580 > 192.168.65.2.6789: Flags [S], seq 609899732, win 64240, options [mss 1460,sackOK,TS val 2195078771 ecr 0,nop,wscale 7], length 0 15:57:06.111633 IP 192.168.65.3.51580 > 192.168.65.2.6789: Flags [S], seq 609899732, win 64240, options [mss 1460,sackOK,TS val 2195080819 ecr 0,nop,wscale 7], length 0
> 15:57:10.143908 IP 192.168.65.3.51580 > 192.168.65.2.6789: Flags [S], seq 609899732, win 64240, options [mss 1460,sackOK,TS val 2195084851 ecr 0,nop,wscale 7], length 0
> 15:57:18.464142 IP 192.168.65.3.51580 > 192.168.65.2.6789: Flags [S], seq 609899732, win 64240, options [mss 1460,sackOK,TS val 2195093171 ecr 0,nop,wscale 7], length 0
> 15:57:34.848536 IP 192.168.65.3.51580 > 192.168.65.2.6789: Flags [S], seq 609899732, win 64240, options [mss 1460,sackOK,TS val 2195109555 ecr 0,nop,wscale 7], length 0
> 15:58:07.103411 IP 192.168.65.3.51580 > 192.168.65.2.6789: Flags [S], seq 609899732, win 64240, options [mss 1460,sackOK,TS val 2195141811 ecr 0,nop,wscale 7], length 0
> ```
> which is a stuck TCP handshake from the Linux point of view. The same thing is probably visible in a live trace from `docker run -it --privileged --net=host djs55/tcpdump -n  -i eth0`.
> 
> Using sysinternals process explorer to examine the vpnkit.exe process, I only see 1 TCP connection at a time (although a larger than ideal number of UDP connections which are DNS-related I think). There's no sign of a resource leak.
> 
> When this manifests I can still establish other TCP connections and run the test again -- the impact seems limited to the 1 handshake failure.
> 
> The vpnkit diagnostics has a single TCP flow registered:
> ```
> > cat .\flows
> TCP 192.168.65.3:51580 > 192.168.65.2:6789 socket = open last_active_time = 1605023899.0
> ```
> which means that vpnkit itself thinks the flow is connected, although the handshake never completed.

**Comment by markoueis** [comment]
Woah, thanks for this update @rg9400. Glad you got it on their radar. So your work around is to restart docker and wsl --shutdown? I've been trying to use another IP (loopback adapter) as opposed to host.docker.internal or whatever host.docker.internal points to. But I'm not 100% sure that solves the problem permanently. Maybe its just a new IP so it will work for a little and then deteriorate again over time. Based on your explanation of the root cause, that might indeed be the case.

**Comment by rg9400** [comment]
Yeah, for now I am just living with it and restarting WSL/Docker every now and then when the connection timeouts become too frequent and unbearable.

**Comment by markoueis** [comment]
What can we do to get this worked on. Is there work happening on it? or a ticket we can follow? This still bugs us quite consistently.

**Comment by markoueis** [comment]
I want to keep this thread alive as this is a massive pain for folks especially because they don't know its happening. This needs to become more reliable.

**Comment by stormmuller** [comment]
We have about 15 services in our docker-compose file and all of them do an `npm install`. A cacheless build is impossible because it tries to build all the services at once and the npm install steps timeout because trying to download that many packages just kills bandwidth. 

I'm not using the `--parallel` flag
I've set the following environment variables: 
- COMPOSE_HTTP_TIMEOUT=240
- COMPOSE_PARALLEL_LIMIT=2

But non of this seems to change the behavior

**Comment by bradleyayers** [comment]
This happens on macOS too, in fact quite reliably after ~7 minutes and ~13,000 requests of hitting a HTTP server:

Server:

```
$ python3 -mhttp.server 8015
```

Client ([siege](https://github.com/JoeDog/siege/)):

```
$ cat <<EOF > siegerc
timeout = 1
failures = 1
EOF
$ docker run --rm -v $(pwd)/siegerc:/tmp/siegerc -t funkygibbon/siege --rc=/tmp/siegerc -t2000s -c2 -d0.1 http://host.docker.internal:8015/api/foo
```

Output:

```
New configuration template added to /root/.siege
Run siege -C to view the current settings in that file
** SIEGE 4.0.4
** Preparing 2 concurrent users for battle.
The server is now under siege...[alert] socket: select and discovered it's not ready sock.c:351: Connection timed out
[alert] socket: read check timed out(1) sock.c:240: Connection timed out
siege aborted due to excessive socket failure; you
can change the failure threshold in $HOME/.siegerc

Transactions:		       13949 hits
Availability:		       99.99 %
Elapsed time:		      378.89 secs
Data transferred:	        6.24 MB
Response time:		        0.00 secs
Transaction rate:	       36.82 trans/sec
Throughput:		        0.02 MB/sec
Concurrency:		        0.10
Successful transactions:           0
Failed transactions:	           1
Longest transaction:	        0.05
Shortest transaction:	        0.00
```

What's interesting is that it gets progressively worse from there, the timeouts happen more and more frequently. Restarting the HTTP server doesn't help, but restarting it on another port does (e.g. from 8019 -> 8020). From there you get another 7 minutes of 100% success before it starts degrading again.

I tried adding an IP alias to my loopback adapter and hitting that instead of `host.docker.internal` but it had the same behavior (i.e. degraded after 7 minutes). The same goes for using the IP (192.168.65.2) and skipping the DNS resolution.

**Comment by rg9400** [comment]
This issue remains unresolved. The devs indicated it required major rework, but I haven't heard back from them in 6 months on the progress.

**Comment by zadirion** [comment]
I am also affected by this issue. I thought at one point it was because of TCP keepalive on sockets, and the sockets not being closed as fast as they are opened, thus a exhausting the max number of available sockets. But the problem doesn't go away even if my containers stop opening connections for a while, only a restart of docker and wsl seems to fix this.
This issue should be on high priority...

**Comment by artzwinger** [comment]
I cannot connect from a container to a host port even using telnet.
Network mode is bridge, which is default, but "host" mode also doesn't work.

I tried to guess host IP, but also I tried this:
extra_hosts:
      - "host.docker.internal:host-gateway"
Both options didn't work.

Telnet connection from host machine to this host port does work well.

In previous Docker versions it was working fine! Seems it's broken since some update maybe from 2021-2022.

**Comment by artzwinger** [comment]
Upd.
It was my Ubuntu UFW that was blocking containers from connecting to host ports.

**Comment by raarts** [comment]
Having this exact problem on MacOS. Restarting Docker fixes the problem (for a while).

**Comment by bernhof** [comment]
We have reports of this occurring across teams on Windows and macOS as well. We have no reports of this issue occuring on Linux.

Someone noticed that on macOS, simply waiting ~15mins often alleviates the problem.

**Comment by metacity** [comment]
We're also experiencing this (using host.docker.internal) on Docker Desktop for Windows. Strangely enough, Docker version up to 4.5.1 seem to work fine, but 4.6.x ja 4.7.x versions instantly bring up the problem. Connections work for some time, but then the timeouts start. All checks of `"C:\Program Files\Docker\Docker\resources\com.docker.diagnose.exe" check` pass.

**Comment by RomanShumkov** [comment]
I'm experiencing the same problem with increasing amount of timeouts over time while using host.docker.internal.

**Comment by levimatheri** [comment]
Any update on this issue? I'm experiencing the same. Restarting the container does not fix it. Only restarting the daemon/host resolves it.

**Comment by bernhof** [comment]
We seem to have resolved the issue on Windows (but not Mac)

We had included the following configuration to allow containers to reach the host using "host.docker.internal" on Windows, Mac and Linux hosts:

    extra_hosts:
    - "host.docker.internal:host-gateway"

Removing this configuration resolved the time out issue on Windows (but can obviously cause other problems). Mac users still have time out issues, though.

**Comment by raeganbarker** [comment]
We are encountering issues with this on `MacOS 12.0`. We determined that our developers using Docker Desktop `4.3.0` have not encountered the issue. We are currently testing downgrading Docker Desktop to `4.3.0`. This seems to have resolved the problem so far. We have not yet tested going all the way back up to `4.5.1` as noted earlier in this thread. We also have not yet observed this issue in Docker on our `x86` Ubuntu environments.

**Comment by jrpope2014** [comment]
> I was able to send this via their support and have them reproduce the issue. They diagnosed the cause, but said it would involve some major refactoring, so they didn't have a target fix date. Below is the issue as mentioned by them
> 
> > I can reproduce the bug now. If I query the vpnkit diagnostics with this program https://github.com/djs55/bug-repros/tree/main/tools/vpnkit-diagnostics while the connection is stuck then I observe: (for my particular repro the port number was 51580. I discovered this using wireshark to explore the trace)
> > ```
> > $ tcpdump -r capture\\all.pcap port 51580
> > 15:57:03.021934 IP 192.168.65.3.51580 > 192.168.65.2.6789: Flags [S], seq 609899732, win 64240, options [mss 1460,sackOK,TS val 2195077730 ecr 0,nop,wscale 7], length 0
> > 15:57:04.064094 IP 192.168.65.3.51580 > 192.168.65.2.6789: Flags [S], seq 609899732, win 64240, options [mss 1460,sackOK,TS val 2195078771 ecr 0,nop,wscale 7], length 0 15:57:06.111633 IP 192.168.65.3.51580 > 192.168.65.2.6789: Flags [S], seq 609899732, win 64240, options [mss 1460,sackOK,TS val 2195080819 ecr 0,nop,wscale 7], length 0
> > 15:57:10.143908 IP 192.168.65.3.51580 > 192.168.65.2.6789: Flags [S], seq 609899732, win 64240, options [mss 1460,sackOK,TS val 2195084851 ecr 0,nop,wscale 7], length 0
> > 15:57:18.464142 IP 192.168.65.3.51580 > 192.168.65.2.6789: Flags [S], seq 609899732, win 64240, options [mss 1460,sackOK,TS val 2195093171 ecr 0,nop,wscale 7], length 0
> > 15:57:34.848536 IP 192.168.65.3.51580 > 192.168.65.2.6789: Flags [S], seq 609899732, win 64240, options [mss 1460,sackOK,TS val 2195109555 ecr 0,nop,wscale 7], length 0
> > 15:58:07.103411 IP 192.168.65.3.51580 > 192.168.65.2.6789: Flags [S], seq 609899732, win 64240, options [mss 1460,sackOK,TS val 2195141811 ecr 0,nop,wscale 7], length 0
> > ```
> > 
> > 
> >     
> >       
> >     
> > 
> >       
> >     
> > 
> >     
> >   
> > which is a stuck TCP handshake from the Linux point of view. The same thing is probably visible in a live trace from `docker run -it --privileged --net=host djs55/tcpdump -n  -i eth0`.
> > Using sysinternals process explorer to examine the vpnkit.exe process, I only see 1 TCP connection at a time (although a larger than ideal number of UDP connections which are DNS-related I think). There's no sign of a resource leak.
> > When this manifests I can still establish other TCP connections and run the test again -- the impact seems limited to the 1 handshake failure.
> > The vpnkit diagnostics has a single TCP flow registered:
> > ```
> > > cat .\flows
> > TCP 192.168.65.3:51580 > 192.168.65.2:6789 socket = open last_active_time = 1605023899.0
> > ```
> > 
> > 
> >     
> >       
> >     
> > 
> >       
> >     
> > 
> >     
> >   
> > which means that vpnkit itself thinks the flow is connected, although the handshake never completed.

@rg9400 this was SUPER helpful... I started running into the same issue. I use dockerized Jupyter on Docker for Windows for a significant amount of my day-to-day work and have been getting CONSTANT timeout errors when I run notebooks from the beginning. I was also restarting Docker a ton, but after finding this comment, I found a way to pretty consistently "unstick" things (though it's definitely still annoying):

```
C:\Users\blah\blah> tasklist | findstr vpnkit.exe
C:\Users\blah\blah> taskkill /F /pid <pid of vpnkit>
```

And then I give it just a sec and when the cell tries again to reestablish connections, it's good.

I don't really think this is a viable solution for folks running processes that are constantly establishing connections, but it works for me currently for Jupyter (once I get data, I don't really need more connections for the notebook though).

Any update from folks working on this issue? I found [something](https://github.com/moby/vpnkit/issues/493) that sounds similar from 2019, but it doesn't look like anyone is making any effort to resolve it on the vpnkit side that I can find right off from searching the issues.

**Comment by hakey1408** [comment]
> Having this exact problem on MacOS. Restarting Docker fixes the problem (for a while).

I'm having the same issue, running docker 4.9.1 on mac and I'm facing the issue very often.
After restarting Docker it works again but is not a long term solution as you mentioned ...

**Comment by razorman8669** [comment]
I'm also affected by this issue.  It seems to hang after just a few minutes and causes network timeouts.  restarting docker fixes it for a few more minutes.  it's practically unusable...

**Comment by rossinineto** [comment]
I tried to use the internal IP of docker host (instead of "host.docker.internal"), but the problem still occurs: in few minutes, the network connection timeout starts again.

**Comment by rossinineto** [comment]
Just run the command

taskkill /im vpnkit.exe /f

and connection with docker host fix

**Comment by razorman8669** [comment]
I can confirm that by downgrading docker desktop for mac to version `4.5.0` "fixes" the problem and I no longer have connection issues.   I tested for several days without any problems.  Then upgraded back to the latest version and started getting timeouts and connection failures almost immediately again.

**Comment by aguedeney** [comment]
+1

I’ve had this issue since 4.5.0 as well. I’m pinned to that release until
it’s fixed.

**Comment by rossinineto** [comment]
Like reported in some quotes here, since a i had a docker 4.9.1 installed, i downgraded docker windows to 4.5.1.
The connection timeout doesn´t occur anymore.

**Comment by Spenhouet** [comment]
While the issue title only refers to connections to the host, it also happens to any other address (independent of internal or external).

**Comment by rossinineto** [comment]
In 4.10 release notes, I didn´t see any mention about this issue.
Did anybody check if the 4.10 version still has this issue?

**Comment by ChinhFong** [comment]
I'm currently working with Laravel so in order to migrate database I have to use 127.0.0.1 and for connection to work I have to use host.docker.internal 
# DB_HOST=127.0.0.1
DB_HOST=host.docker.internal
Windows 10 , Docker Desktop 4.10.1 (82475)

**Comment by kevinmcmurtrie** [comment]
> We have reports of this occurring across teams on Windows and macOS as well. We have no reports of this issue occuring on Linux.
> 
> Someone noticed that on macOS, simply waiting ~15mins often alleviates the problem.

As of Docker version 20.10.17, build 100c701 on Ubuntu 22.04, it happens on Linux.

I'm using Docker to run Kiwix scrapers.  They work while then start hitting timeouts.  If the scraped host has multiple IP addresses, it can round-robin and keep running.  If the host only has one, the task is likely to fail from too many timeouts.

- The problem happens only between a specific container and a specific TCP destination address.  The connection partially opens to some degree but never completes or is never capable of sending data.
- Ping works for the problem host even while TCP doesn't
- Containers don't seem to influence each others' bug in any way.
- The problem resolves itself after several minutes
- Hitting another IP address from within the container resolves the address that was broken
- Containers hitting a variety of IP addresses haven't been observed with the problem
- There's no min/max traffic threshold observed for the bug
- It's not the SNAT bug.  I'm running IPv6 without NAT and TCP container-host pairs get stuck in IPv4 and IPv6 equally.
- No firewall counts are incrementing

**Comment by Mathias-S** [comment]
Everyone on my team with Mac (we only have mix of Mac and Linux) are also experiencing this problem. It manifests itself after 1-3 days without restarting, but during that timeframe we probably have on the order of 10,000 outbound HTTP calls, similar to what was mentioned in https://github.com/docker/for-win/issues/8861#issuecomment-903421446.

This seems like a very serious issue if it happens so consistently.

Our solution was to stop using Docker for certain containers with high traffic volume on (non-Linux) developer machines.

**Comment by jdeitrick80** [comment]
I have also seen this issue in versions >4.5.0 including the latest version, but have found that it can also be triggered with low amounts of traffic.  The following is how I have been able to reproduce the issue.

```
docker run --name session-test -it -v /mnt/c/Users/jde/sessions/test:/test python:buster bash
root@17c8b33e70e6:/# pip install --quiet requests
root@17c8b33e70e6:/# cd test/
root@17c8b33e70e6:/test# python sessions.py
10:52:18: request 1
Request complete, sleep 30
10:52:50: request 2
Request complete, sleep 120
10:54:51: request 3
Request complete, sleep 420
11:01:51: request 4
Traceback (most recent call last):
  File "/usr/local/lib/python3.10/site-packages/urllib3/connection.py", line 174, in _new_conn
    conn = connection.create_connection(
  File "/usr/local/lib/python3.10/site-packages/urllib3/util/connection.py", line 95, in create_connection
    raise err
  File "/usr/local/lib/python3.10/site-packages/urllib3/util/connection.py", line 85, in create_connection
    sock.connect(sa)
TimeoutError: [Errno 110] Connection timed out
```
sessions.py
```
import requests
from datetime import datetime
import time

s = requests.Session()

steps = [30, 120, 420, 420]
step = 1
for i in steps:
    print(datetime.now().strftime("%H:%M:%S") + ": request " + str(step))
    r3 = s.get('https://wttr.in')
    print("Request complete, sleep " + str(i))
    step+=1
    time.sleep(i)
```
As has been mentioned before if I look at a trace from the containers point of view I only see TCP SYNs being sent out during the 4th attempt after waiting 420s since the last request.  Also if I kill the vpnkit while it is still trying the 4th attempt then when the vpnkit starts back up the 4th requests is able to complete successfully.

Some things that I have noticed that I do not think were previously mentioned.   If I look at a trace from the host I see the TCP SYNs going out and TCP SYN ACKs coming back from the server, but these are not passed on to the container.  If I start up another container while the first is trying unsuccessfully to do the 4th attempt it also is not able to reach the same destination, but is able to reach other destinations.

```
docker run -it python:buster bash
root@14437db6e250:/# curl https://wttr.in
curl: (7) Failed to connect to wttr.in port 443: Connection timed out
root@14437db6e250:/# curl https://google.com
<HTML><HEAD><meta http-equiv="content-type" content="text/html;charset=utf-8">
<TITLE>301 Moved</TITLE></HEAD><BODY>
<H1>301 Moved</H1>
The document has moved
<A HREF="https://www.google.com/">here</A>.
</BODY></HTML>
root@14437db6e250:/# curl https://wttr.in
curl: (7) Failed to connect to wttr.in port 443: Connection timed out
```

The cause of the issue seems to have something to do with using sessions and having a client side keep alive interval being >=60s.   If I change to a 30s client keep alive interval  I do not run into the issue.

```
docker run --name session-test -it -v /mnt/c/Users/jde/sessions/test:/test python:buster bash
root@425db0e6590a:/# pip install --quiet requests
root@425db0e6590a:/# cd test/
root@425db0e6590a:/test# python sessions-ka30.py
11:41:35: request 1
Request complete, sleep 30
11:42:06: request 2
Request complete, sleep 120
11:44:06: request 3
Request complete, sleep 420
11:51:06: request 4
Request complete, sleep 420
root@425db0e6590a:/test#
```
sessions-ka30.py
```
import requests
from datetime import datetime
import time

import socket
from requests.adapters import HTTPAdapter

class HTTPAdapterWithSocketOptions(HTTPAdapter):
    def __init__(self, *args, **kwargs):
        self.socket_options = kwargs.pop("socket_options", None)
        super(HTTPAdapterWithSocketOptions, self).__init__(*args, **kwargs)

    def init_poolmanager(self, *args, **kwargs):
        if self.socket_options is not None:
            kwargs["socket_options"] = self.socket_options
        super(HTTPAdapterWithSocketOptions, self).init_poolmanager(*args, **kwargs)

KEEPALIVE_INTERVAL = 30
adapter = HTTPAdapterWithSocketOptions(socket_options=[(socket.SOL_SOCKET, socket.SO_KEEPALIVE, 1),
(socket.IPPROTO_TCP, socket.TCP_KEEPIDLE, KEEPALIVE_INTERVAL), (socket.IPPROTO_TCP, socket.TCP_KEEPINTVL, KEEPALIVE_INTERVAL)])
s = requests.Session()
s.mount("http://", adapter)
s.mount("https://", adapter)

steps = [30, 120, 420, 420]
step = 1
for i in steps:
    print(datetime.now().strftime("%H:%M:%S") + ": request " + str(step))
    r3 = s.get('https://wttr.in')
    print("Request complete, sleep " + str(i))
    step+=1
    time.sleep(i)
```
I hope this information helps in resolving the issue or provides a work around for others experiencing it.

I have also added this information to [https://github.com/moby/vpnkit/issues/587](url)

**Comment by rossinineto** [comment]
V4.5.1 works fine. Than I removed the docker desktop windows, cleaned all the junk files left and reinstalled the version v.4.12.0. And the connection problem started again.

**Comment by rossinineto** [comment]
![Captura de tela 2022-09-12 073428](https://user-images.githubusercontent.com/19964607/189633162-8a34a402-ce87-49b6-a88e-442a72154f46.png)

**Comment by clemp6r** [comment]
I had a similar issue (very frequent request timeouts) that seemed to be resolved after upgrading from Docker Desktop 4.11.1 to 4.11.2.

**Comment by nk9** [comment]
My team is using Docker Desktop on both Macs and Windows and I beleive we have been seeing this for many months. It manifests as having connections to two AWS hosts hang after awhile: `ssm.us-east-2.amazonaws.com` and `cognito-idp.us-east-2.amazonaws.com`. Other hosts work fine, and the two hosts are reachable from outside Docker. After 5–10 minutes, connections stop failing. But the longer the Docker process has been running, the more frequently the connection failures occur.

Restarting the container doesn't fix the problem. Restarting the Docker process stops it from happening for awhile.

I was on a recent version of Docker Desktop for Mac, I think 4.13.0, and I was seeing the problem reliably. After finding this issue, I've gone back to 4.5.0. Things have been fine for a day, so I'm hoping that's a workaround while we wait for a fix.

I am concerned that this issue doesn't have the priority it deserves. I'm not doing anything particularly intensive with my container, just running a web app. We don't even hit the AWS servers that often. I think many people are probably seeing this and blaming it on ISP/network issues or hosts being down, when in fact the problem is Docker itself. It took me months of on-and-off debugging (because the problem is so intermittent) to finally look for a GitHub issue her; I thought it was something to do with the way I was calling the AWS hosts. I get that the solution is hard, but I'd like to see Docker at least announce that they have a plan to address this after 2 years of steadily increasing impact.

**Comment by rg9400** [comment]
I think the only way to increase visibility is to submit official bug reports to the team linking to this issue. My official ticket with them (where the issue was discovered) keeps asking me to confirm it is still an issue to prevent auto-closure, and I have not been able to get a team's update beyond one from a few months ago where they asked if this had resolved itself (to which I replied it had not).

**Comment by robertnisipeanu** [comment]
This issue was fixed for me after editing `~/Library/Group\ Containers/group.com.docker/settings.json` and setting `vpnKitMaxPortIdleTime` from `300` to `0`. I have changed this over a week ago and till now I did not encounter the issue again.

**Comment by rg9400** [comment]
The reason I mentioned contacting Docker was because this was my latest communication on them, which you can see is pretty frustrating

> I did some investigation on this one.
> 
> We have parsed through the thread and users seem to be able to address the issue by restarting WSL, so it’s not a blocker.
> A ticket has been created from the begining (2 years ago) but as it is not a blocker, we don’t see us getting to this over the course of the next few months.
> Once resolved we will update the issue on github.
>  
> Sorry for the incovenience.
>  
> Doscker  Support

**Comment by nk9** [comment]
Apart from anything else, it doesn't address the problem for users who aren't on Windows.

**Comment by levimatheri** [comment]
> > Sorry for the incovenience.
> > Doscker  Support

Lol they can't even spell their own product sigh...

**Comment by Spenhouet** [comment]
Just a reminder that this is actually an issue with vpnkit and also affects Mac.
That partially might be the reason why no one of the docker for win team feels responsible fixing this.

**We need to actively raise this on the vpnkit project and not here!**

e.g. you can voice your support here: https://github.com/moby/vpnkit/issues/587

**Comment by gregfrog** [comment]
> Thanks for the update, and I will file a support request. Apart from anything else, their answer ignores that this is an issue for users who aren't on Windows. Just restarting Docker Desktop all the time isn't an acceptable workaround IMO.

I suspect I am running into this at the moment.  If having to restart the VM that Docker is running in, rebooting in essence, is not a blocker, what is?  Hardware damage?

**Comment by tristanbrown** [comment]
This is absolutely a blocker for me, as I cannot run scheduled tasks reliably.

**Comment by roele** [comment]
The following workaround resolved the issue for me
https://emerle.dev/2022/05/06/the-nasty-gotcha-in-docker/

**Comment by acedanger** [comment]
> The following workaround resolved the issue for me
> https://emerle.dev/2022/05/06/the-nasty-gotcha-in-docker/

Adding an archive in case the post or site goes down.

https://archive.ph/fk6dC

**Comment by nk9** [comment]
While this is useful information, I am not sure that it's actually related to this bug. The error described in the post is "Connection reset by peer." However, the problem in this issue is "Connection timed out." The exact error may differ depending on which software you're using, but the key thing is that you send packets that just never arrive. The connection isn't reset, it just stops moving data and effectively becomes `/dev/null`.

There are reproduction steps here, and I'm happy to be proven wrong. If someone can run the Python reproduction above and confirm that the problem doesn't occur on recent versions of Docker Desktop with the idle time set to `0`, then I'll stand corrected. But @rg9400 spoke with Docker themselves, who acknowledged the problem and said they didn't have a fix. If the solution was as easy as changing `vpnKitMaxPortIdleTime`, surely they would have mentioned that.

If you would like changes in the behavior of `vpnKitMaxPortIdleTime`, I suggest you open a different issue.

**Comment by robertnisipeanu** [comment]
I also replied a few months ago with that fix, and my problem was a connection time out for an nginx reverse proxy and PING command, not a connection reset.

**Comment by tristanbrown** [comment]
I'm thinking this is a port saturation issue, similar to what's described [here](https://learn.microsoft.com/en-us/troubleshoot/windows-client/networking/tcp-ip-port-exhaustion-troubleshooting). I recently restarted my Docker service, but once the problem crops up again, I'll try going through some of these troubleshooting steps.

**Comment by BenjaminPelletier** [comment]
I'm about 90% sure this issue applies to me as well, but it's devilishly difficult to tell for sure.  I'll refer to [a tool for reproduction](https://github.com/BenjaminPelletier/request_failures) that I wrote in my observations below:

1. The issue appears to happen about once every 10^1 continuous integration invocations on [a project I work on](https://github.com/interuss/monitoring), and each continuous integration run probably has 10^3-10^4 HTTP requests sent between containers on the same GitHub Actions Linux cloud VM
1. The issue also happens on my development machine, a laptop with MacOS Ventura 13.2.1
1. All requests I have observed this issue with have been addressed to `host.docker.internal`, perhaps mainly because nearly all of my requests are addressed there, but while troubleshooting I was unable to reproduce when sending requests to an IP (using Docker's default bridge network) nor a service name (using a custom bridge network created for the purpose) -- see the reproduction repo for more notes.
1. The rate of occurrence varies a lot, and not according to any pattern I've been able to identify.  The past week, I've had a connection timeout within 10^1-10^2 requests on my development machine with that rate persisting through a laptop reboot.  After creating a Docker network to (unsuccessfully) attempt reproduction with containers communicating through that network, not only did the issue not occur using the custom bridge network, but the issue also vanished entirely -- my 100% reliable method of reproduction went to 0%.
1. The issue does not depend on long handlers; I could reliably (at a ~10% rate) reproduce the issue sending queries to an unconfigured `nginx` container
1. The issue does not depend on long timeouts; my simple reproduction used 5-second timeouts
1. The issue does not depend on a long-running container; I could `rm -f` the client+server containers, start a new client container with a slightly different image, and have the issue reproducing within the first 100 requests at one time on my laptop
1. The issue does not depend on external network traversal; all my observations have been for requests between containers on the same system using `host.docker.internal`.

**Comment by tutcugil** [comment]
We are experiencing same issue, almost every 10 minutes, SQL queries from our containers getting slower, then it resolves until the next 10 minute period.

Docker Desktop version v4.17.0
Windows Server 2022 - WSL2 1.0.3.0 backend

is there any update on this?

**Comment by rhux** [comment]
> The following workaround resolved the issue for me https://emerle.dev/2022/05/06/the-nasty-gotcha-in-docker/

I had also been experiencing this for several months. Doing this workaround appears to have fixed the issue.

**Comment by ganeshkrishnan1** [comment]
Got this issue with windows 11 on WSL and Docker version 23.0.3, build 3e7cbfd

We are running to server so this error becomes untenable.

**Comment by nk9** [comment]
Please note that an experimental build of vpnkit has been released in [this parallel issue](https://github.com/moby/vpnkit/issues/587?notification_referrer_id=NT_kwDOADelCrIzODcwNTAyNDM3OjM2NDY3MzA#issuecomment-1513184793) which attempts to resolve what may be the underlying problem here. Users experiencing this should install the experimental builds if possible and feed back to @djs55 as to whether the problem is resolved, and if you notice any side effects.

**Comment by rg9400** [comment]
Per my testing of the experimental build, the issue is significantly improved but not resolved. There are still timeouts, just a lot less. When running thousands of curls, I still notice stuck handshakes that don't instantly close but take a minute or two to resolve. The difference is that most such instances do clear out before the timeout.

I just still wanted to confirm that the connections still are getting stuck even if the overall symptoms are a lot better

**Comment by Junto026** [comment]
I believe I am facing this same problem on MacOS Sonoma 14.1.1, running Docker Desktop for Mac (Apple Silicon) 4.25.2.

I want to try downgrading to 4.5.0 (it's insane the issue is going on that long).  Does anybody have an install file?  The oldest available [here](https://docs.docker.com/desktop/release-notes/#450) is 4.9.1.

EDIT: Docker Desktop for MacOS (Apple Silicon) can be downloaded [here](https://desktop.docker.com/mac/main/arm64/74594/Docker.dmg).

EDIT2: Confirmed, downgrading fixed the issue. I’ve been running with stable connections for weeks now.

**Comment by sorcer1122** [comment]
Facing the same issue on Debian 12. Checked ufw logs and whitelisted container's IP address with `sudo ufw allow from 172.17.0.2`, this fixed it.

**Comment by kierankhan** [comment]
Pretty stuck on this as I am not using docker desktop, only docker engine on ubuntu. Reverting to 4.5.0 (docker engine 20.10.12) breaks everything, so if anyone has other workarounds lmk

**Comment by Junto026** [comment]
> Pretty stuck on this as I am not using docker desktop, only docker engine on ubuntu. Reverting to 4.5.0 (docker engine 20.10.12) breaks everything, so if anyone has other workarounds lmk

If you’re running on Linux I don’t think you’ll experience this exact issue.  It seems to only happen when running Docker on MacOS or Windows.

**Comment by ashwinrayaprolu** [comment]
I'm too facing this issue.. 
While not windows, i can pretty much replicate this issue on linux

`seq 1 100000 | xargs -Iname -n1 -P200   curl --write-out ' %{http_code} , %{time_total}s \n' --silent --output /dev/null "http://10.98.160.112/health" |  awk '{ if ( $3+0 > 0.06 ) print $1, $3}'`

Just used a curl parallel request features to test response code and time taken..
It starts going up

<img width="1086" alt="image" src="https://github.com/user-attachments/assets/7e3dabbd-5d35-434b-9fbb-6b088a51199f">

**Comment by phygineer** [comment]
same observations on mac, still not fixed

It took me a while to realize this issue.

<img width="1420" alt="Screenshot 2024-08-28 at 1 39 44 AM" src="https://github.com/user-attachments/assets/70c06e23-7496-4c2c-bc8e-ba1f7cfcfb8d">
<img width="1405" alt="Screenshot 2024-08-28 at 1 39 25 AM" src="https://github.com/user-attachments/assets/c9bc6cb1-5502-47a4-baea-c283336aa6f4">

**Comment by hoshiizumiya** [comment]
Update: After my comparison, I think my problem is the chain telecom's stable problem. The china mainland's international network with the public 163 net has a very poor quality. All the monitor in the mainland is OK without timeout.

---

I may be seeing a modern variant of this problem on Windows + WSL2 + Docker Desktop, although my traffic direction is the reverse of the original report.

### Observed behavior

I run Uptime Kuma on a completely separate native Ubuntu/Linux host. It monitors the same HTTP(S) service hosted inside Docker on a Windows/WSL2 machine using two independent monitors:

* one forced to IPv4; (WSL2 with NAT mode)
* one forced to IPv6. (No NAT)

The result is strongly asymmetric:

* IPv6 remains healthy.
* IPv4 increasingly/frequently times out; currently roughly 90% of IPv4 probes can time out while IPv6 to the same application remains healthy.
* The same Uptime Kuma instance monitors other Linux-hosted IPv4 services without this problem.
* The web application/container remains alive and reachable over IPv6 while the IPv4 probe is failing.

The topology is approximately:

```text
remote native Ubuntu / Uptime Kuma
        |
     Internet
        |
   public IPv4
        |
Windows host
        |
WSL2 / Docker Desktop networking
        |
published Docker port
        |
containerized web service
```

So, unlike the original #8861 reproduction (`container -> Windows host`), my failing direction is:

```text
remote Linux client
    -> Windows IPv4
    -> WSL2 / Docker Desktop networking
    -> published Docker port
    -> container
```

### A possibly related Uptime Kuma report

There is an old Uptime Kuma issue that may be relevant:

https://github.com/louislam/uptime-kuma/issues/275

The reported application-level symptom is almost exactly what I see:

```text
timeout of 48000ms exceeded
```

while the monitored site itself is still available.

Importantly, the original reporter was running Uptime Kuma under Docker Desktop for Windows + WSL2. After running Uptime Kuma outside Docker, they reported that the previously recurring timeout errors disappeared during the test period and concluded:

> "So Docker for Windows + WSL2 was the culprit here."

I do not think #275 proves that this is the same underlying bug. The traffic direction there was effectively `Windows Docker/WSL2 container -> remote site`, whereas my case is `remote site -> Windows Docker/WSL2 container`.

However, it is an interesting independent report showing the same higher-level timeout symptom specifically associated with the Docker Desktop + WSL2 network path.

### Why #8861 looks particularly relevant

What makes this issue much more interesting than a generic timeout report is the old TCP-level diagnostics in this thread.

During a failed connection, Linux repeatedly transmitted SYN packets:

```text
SYN
SYN
SYN
...
```

while the Docker networking backend's flow diagnostics considered the corresponding flow/socket open.

The related `moby/vpnkit#587` investigation showed an even clearer state divergence in another reproduction:

```text
container sends SYN
        |
Windows host sends SYN
        |
remote server returns SYN-ACK
        |
Windows host receives SYN-ACK
        |
        X
SYN-ACK is not delivered back to the container
```

In other words, the host-side packet capture and the container-side TCP state did not agree about the progress of the handshake.

That makes a stale or incorrect per-flow forwarding/TCP state inside the Docker Desktop networking path a plausible explanation, rather than ordinary packet loss, DNS failure, or the monitored application being slow.

The fact that restarting WSL/Docker clears the historical issue temporarily also seems consistent with resetting such network/flow state.

I realize Docker Desktop's networking implementation has changed considerably since the original vpnkit diagnostics, so I do **not** want to assume that the old vpnkit bug still exists unchanged. My question is whether the current Windows/WSL2 networking backend can exhibit an equivalent failure mode.

### Why the IPv4 / IPv6 difference may help localize it

My IPv4 and IPv6 monitors target the same application at the same time.

Therefore:

```text
application healthy over IPv6
+
application timing out over IPv4
```

makes an application-level failure much less likely.

It also gives a useful control path: I can capture a failed IPv4 connection and a successful IPv6 connection to the same container at approximately the same time and compare exactly where their forwarding paths diverge.

### Proposed packet-level diagnosis

I can capture one failed IPv4 probe simultaneously at three layers.

#### 1. Remote Ubuntu / Uptime Kuma host

Use `tcpdump` to determine:

* whether the SYN leaves the monitoring host;
* whether any SYN-ACK returns.

#### 2. Windows physical/network interface

Use Wireshark or `pktmon` to determine:

* whether the inbound IPv4 SYN reaches Windows;
* whether Windows emits a corresponding SYN-ACK.

#### 3. WSL2 / Docker side

Capture around the WSL/Docker interfaces and the container to determine:

* whether the SYN is delivered to the container;
* whether the container generates the SYN-ACK;
* whether that SYN-ACK crosses back into the Windows side.

This should distinguish several cases:

```text
Remote SYN never appears on Windows
    -> upstream/router/ISP path

SYN reaches Windows but never reaches Docker/container
    -> Windows/WSL2/Docker ingress or published-port forwarding

Container receives SYN and emits SYN-ACK,
but SYN-ACK never appears on the Windows external interface
    -> WSL2/Docker return path or backend flow state

Windows sends SYN-ACK but remote Linux never receives it
    -> upstream/router/ISP return path
```

IPv6 can be captured simultaneously as the healthy control.

### Question for maintainers

Is there a current equivalent of the old vpnkit flow diagnostics that can expose the networking backend's per-flow state while a connection is stuck?

In particular, I would like to compare the **actual TCP state visible in packet captures** against the **state Docker Desktop's networking backend believes that flow is in**

If there are relevant `com.docker.backend` diagnostics, internal flow tables, ETW providers, diagnostic bundle components, or other tracing facilities for the current WSL2 networking implementation, I can collect them while an IPv4 Uptime Kuma probe is actively stuck. But it's not an easy thing

That seems like the most direct way to determine whether this is another instance of the historical flow-state problem or a different IPv4 forwarding failure.
